{
    "people": {
        "users": [
            "Solo"
        ]
    },
    "sample": {
        "label": "No components field present",
        "physical_form": ""
    },
    "buffer": {},
    "nmr_tube": {},
    "reference": {},
    "metadata": {
        "schema_version": "0.2.0",
        "schema_source": "https://raw.githubusercontent.com/nmr-samples/schema/main/versions/v0.2.0/schema.json"
    }
}